Summary,Issue Type,Priority,Description,Labels,Component,Assignee,Story Points,Status
"Crear página AdminProductos (gestión CRUD completa)",Task,High,"Panel administrativo con tabla de productos, búsqueda y acciones CRUD","admin,crud,productos","Panel Admin","Claudio Francisco Delgado Gallardo",8,Done
"Crear componente AdminProductoForm (crear/editar productos)",Task,Medium,"Formulario completo para agregar/editar productos con validaciones","admin,productos,form","Panel Admin","Claudio Francisco Delgado Gallardo",5,Done
"Implementar funcionalidad eliminar productos con confirmación",Task,Medium,"Eliminar productos con modal de confirmación y actualización de stock","admin,productos,crud","Panel Admin","Claudio Francisco Delgado Gallardo",3,Done
"Crear página AdminUsuarios (listado CRUD)",Task,High,"Página administrativa con tabla de usuarios, filtros y acciones CRUD","admin,crud,usuarios","Panel Admin","Claudio Francisco Delgado Gallardo",8,Done
"Crear componente AdminUsuarioForm (crear/editar usuarios)",Task,Medium,"Formulario reutilizable para crear y editar usuarios desde el panel admin","admin,usuarios,form","Panel Admin","Claudio Francisco Delgado Gallardo",5,Done
"Implementar funcionalidad eliminar usuarios",Task,Medium,"Permitir a administradores eliminar usuarios con confirmación modal","admin,usuarios,crud","Panel Admin","Claudio Francisco Delgado Gallardo",3,Done
"Crear página AdminDestacados (gestión productos destacados en carrusel)",Task,Medium,"Panel para seleccionar hasta 6 productos destacados que aparecen en homepage","admin,productos,destacados","Panel Admin","Claudio Francisco Delgado Gallardo",5,Done
"Crear estilos CSS para Panel Administrativo (Admin.css)",Task,Medium,"Estilos completos para todas las páginas del panel admin","css,estilos,admin","Estilos","Claudio Francisco Delgado Gallardo",5,Done
"Crear página AdminLogs (auditoría de acciones)",Task,Medium,"Sistema de logs con filtros por tipo, fecha y usuario para auditoría completa","admin,logs,auditoria","Panel Admin","Claudio Francisco Delgado Gallardo",5,Done
"Implementar logManager.js (sistema de registro de eventos)",Task,Medium,"Utilidad para registrar todas las acciones administrativas (CRUD, login, etc.)","utilidades,logs,auditoria","Utilidades","Claudio Francisco Delgado Gallardo",3,Done
"Crear componente ModalConfirmacion (confirmación de acciones destructivas)",Task,Medium,"Modal reutilizable para confirmar eliminaciones y acciones irreversibles","components,ui,modal","Componentes","Giovanni Antonio Orellana Muñoz",3,Done
"Crear página Contacto con formulario y validación",Task,Medium,"Formulario de contacto con validaciones, mapa y datos de contacto","paginas,contacto,form","Páginas Públicas","Giovanni Antonio Orellana Muñoz",5,Done
"Crear página Nosotros (información de la empresa)",Task,Low,"Página institucional con misión, visión, historia y equipo","paginas,nosotros,institucional","Páginas Públicas","Giovanni Antonio Orellana Muñoz",3,Done
"Crear página Noticias (contenido gaming)",Task,Low,"Sección de noticias sobre gaming, lanzamientos y eventos","paginas,noticias,contenido","Páginas Públicas","Giovanni Antonio Orellana Muñoz",3,Done
"Crear estilos CSS para Header (Header.css)",Task,Medium,"Navegación responsive con dropdown de carrito y menú mobile","css,estilos,header","Estilos","Rodrigo Yarzu",3,Done
"Crear estilos CSS para página Contacto (Contacto.css)",Task,Low,"Estilos de formulario, mapa y sección de información de contacto","css,estilos,contacto","Estilos","Giovanni Antonio Orellana Muñoz",2,Done
"Crear estilos CSS para página Nosotros (Nosotros.css)",Task,Low,"Diseño de secciones institucionales (misión, visión, equipo)","css,estilos,nosotros","Estilos","Giovanni Antonio Orellana Muñoz",2,Done
"Crear estilos CSS para página Noticias (Noticias.css)",Task,Low,"Diseño de tarjetas de noticias y layout tipo blog","css,estilos,noticias","Estilos","Giovanni Antonio Orellana Muñoz",2,Done
"Configurar Karma + Jasmine para testing",Task,High,"Instalar y configurar Karma como test runner y Jasmine como framework","testing,configuracion,karma","Testing","Giovanni Antonio Orellana Muñoz",8,Done
"Configurar karma.conf.js completo",Task,Medium,"Archivo de configuración de Karma con Chrome launcher, Webpack y reporters","testing,karma,configuracion","Testing","Giovanni Antonio Orellana Muñoz",3,Done
"Configurar Webpack para bundling de tests",Task,Medium,"Setup de Webpack con Babel para transpilar tests a ES5","testing,webpack,configuracion","Testing","Giovanni Antonio Orellana Muñoz",5,Done
"Instalar y configurar Testing Library",Task,Medium,"Instalar @testing-library/react, jest-dom y user-event para testing avanzado","testing,dependencias,configuracion","Testing","Giovanni Antonio Orellana Muñoz",3,Done
"Crear tests de Login (4 tests)",Task,High,"Tests unitarios: email vacío, formato email, password vacío, validar credenciales","testing,login,validacion","Testing","Giovanni Antonio Orellana Muñoz",5,Done
"Crear tests de Registro (4 tests)",Task,High,"Tests: formato RUN, longitud nombre, longitud apellidos, emails duplicados","testing,registro,validacion","Testing","Giovanni Antonio Orellana Muñoz",5,Done
"Crear tests de Carrito (2 tests)",Task,Medium,"Tests: agregar producto al carrito, validar stock disponible","testing,carrito,validacion","Testing","Giovanni Antonio Orellana Muñoz",3,Done
"Crear estilos CSS para Footer (Footer.css)",Task,Low,"Footer con redes sociales, enlaces y copyright","css,estilos,footer","Estilos","Giovanni Antonio Orellana Muñoz",2,Done
"Crear componente CarritoDebug para desarrollo",Task,Low,"Componente de debugging que muestra estado del carrito en tiempo real","debug,carrito,dev","Desarrollo","Rodrigo Yarzu",2,Done
